{
  "$schema": "https://json-schema.org/draft/2020-12/schema",
  "$id": "https://raw.githubusercontent.com/yzm1/boundver/v0.16.0/spec/boundary.lock.schema.json",
  "title": "boundver lockfile schema",
  "$defs": {
    "sha256": {"type": "string", "pattern": "^[0-9a-f]{64}$"},
    "nullableSha256": {
      "oneOf": [
        {"$ref": "#/$defs/sha256"},
        {"type": "null"}
      ]
    }
  },
  "type": "object",
  "required": ["schema", "config_contract", "config_digest", "project", "components", "slices"],
  "properties": {
    "$schema": {"type": "string", "format": "uri"},
    "schema": {"const": "boundary-lock/v4"},
    "config_contract": {"const": "boundver-semantic-config/v3"},
    "config_digest": {
      "$ref": "#/$defs/sha256",
      "description": "SHA-256 of the canonical semantic configuration."
    },
    "project": {"type": "string", "minLength": 1},
    "components": {
      "type": "object",
      "propertyNames": {"type": "string", "minLength": 1},
      "additionalProperties": {
        "type": "object",
        "required": ["version", "path", "boundary_provider", "boundary_provider_version", "boundary_status", "consumers", "external_consumers", "fingerprints", "semver"],
        "properties": {
          "version": {"type": ["string", "null"]},
          "path": {"type": "string", "minLength": 1},
          "boundary_provider": {"type": "string", "minLength": 1},
          "boundary_provider_version": {"type": ["string", "null"]},
          "boundary_status": {"type": "string", "enum": ["ok", "partial", "error"]},
          "consumers": {
            "type": "array",
            "items": {"type": "string"},
            "uniqueItems": true
          },
          "external_consumers": {
            "type": "array",
            "items": {"type": "string"},
            "uniqueItems": true
          },
          "fingerprints": {
            "type": "object",
            "required": ["exact", "behavior", "boundary", "compat"],
            "properties": {
              "exact": {"$ref": "#/$defs/nullableSha256"},
              "behavior": {"$ref": "#/$defs/nullableSha256"},
              "boundary": {"$ref": "#/$defs/nullableSha256"},
              "compat": {"$ref": "#/$defs/nullableSha256"}
            },
            "additionalProperties": false
          },
          "semver": {
            "type": "object",
            "required": ["compat_family", "api_surface", "exact_version"],
            "properties": {
              "compat_family": {"type": ["string", "null"]},
              "api_surface": {"type": ["string", "null"]},
              "exact_version": {"type": ["string", "null"]}
            },
            "additionalProperties": false
          },
          "boundary_errors": {"type": "array", "items": {"type": "string"}},
          "version_errors": {"type": "array", "items": {"type": "string"}},
          "behavior_errors": {"type": "array", "items": {"type": "string"}},
          "exact_errors": {"type": "array", "items": {"type": "string"}},
          "boundary_metadata": {"type": ["object", "null"]},
          "warnings": {"type": "array", "items": {"type": "string"}},
          "vendored_errors": {"type": "array", "items": {"type": "string"}},
          "vendored_copies": {"type": "array", "items": {"type": "string"}},
          "vendored_digests": {"type": "object", "additionalProperties": {"$ref": "#/$defs/sha256"}}
        },
        "additionalProperties": false
      }
    },
    "slices": {
      "type": "object",
      "propertyNames": {"type": "string", "minLength": 1},
      "additionalProperties": {
        "type": "object",
        "required": ["description", "mode", "components", "fingerprint", "component_digests"],
        "properties": {
          "description": {"type": "string"},
          "mode": {"type": "string", "enum": ["exact", "behavior", "boundary", "compat"]},
          "components": {"type": "array", "items": {"type": "string"}},
          "fingerprint": {"$ref": "#/$defs/sha256"},
          "component_digests": {
            "type": "object",
            "additionalProperties": {"$ref": "#/$defs/nullableSha256"}
          }
        },
        "additionalProperties": false
      }
    }
  },
  "additionalProperties": false
}
