{
  "$schema": "https://raw.githubusercontent.com/yzm1/boundver/v0.16.0/spec/boundary.lock.schema.json",
  "schema": "boundary-lock/v4",
  "config_contract": "boundver-semantic-config/v3",
  "config_digest": "54a0feec077234dd14d6dfd5a9b1df37b164332c38f6317c83ead6a187ef63c4",
  "project": "example-typescript-package",
  "components": {
    "pkg": {
      "version": "2.1.0",
      "path": "examples/typescript-package/src",
      "boundary_provider": "typescript-exports",
      "boundary_provider_version": "3",
      "boundary_status": "ok",
      "consumers": [],
      "external_consumers": [],
      "fingerprints": {
        "exact": "6ad95bb80cd9696f63087998a6d3371a121f3127ef1412d97daa5eb03897c65d",
        "behavior": null,
        "boundary": "97d3b2ad9f4dc9cafb61edad58dd78d62b50f2cab910cd5d37515ffd436ca5ac",
        "compat": "e04ddbe80dd1edeab55821dbe157943486507534b7baaeacdeb225347fd10682"
      },
      "semver": {
        "compat_family": "2",
        "api_surface": "2.1",
        "exact_version": "2.1.0"
      }
    }
  },
  "slices": {
    "pkg-boundary": {
      "description": "",
      "mode": "boundary",
      "components": [
        "pkg"
      ],
      "fingerprint": "80a2f99775f25a2e8d09b5f57d594ec7e08854236e89adaf166c0c6ea0019817",
      "component_digests": {
        "pkg": "97d3b2ad9f4dc9cafb61edad58dd78d62b50f2cab910cd5d37515ffd436ca5ac"
      }
    }
  }
}
