{
  "$schema": "https://raw.githubusercontent.com/yzm1/boundver/v0.16.0/spec/boundary.lock.schema.json",
  "schema": "boundary-lock/v4",
  "config_contract": "boundver-semantic-config/v3",
  "config_digest": "6e863507b864e6d3e192e87fee5ccc50c99b249744ba5f672deb4c2f56c787a9",
  "project": "example-behavior",
  "components": {
    "payment-svc": {
      "version": "2.1.0",
      "path": "examples/behavior/service",
      "boundary_provider": "openapi",
      "boundary_provider_version": "3",
      "boundary_status": "ok",
      "consumers": [],
      "external_consumers": [],
      "fingerprints": {
        "exact": "ec2fa1c34a46dff219d6c881bd4b853a1e580658e2e45a0753443265ca1f7dbd",
        "behavior": "5a0bfbf69284280a6d8963fe05ff89f36c7dde7a99e5e70d4f833a3bb5ee086b",
        "boundary": "8ef1e56a607e4d4a5c12bed4eb0a4e9b753afb38790a34e362cbc954379aa53c",
        "compat": "85e5cd77fa1a3e08ce7e859a1326c924c6b43db9d3dfdda278f92c3d33fa43a0"
      },
      "semver": {
        "compat_family": "2",
        "api_surface": "2.1",
        "exact_version": "2.1.0"
      }
    }
  },
  "slices": {
    "payment-boundary": {
      "description": "",
      "mode": "boundary",
      "components": [
        "payment-svc"
      ],
      "fingerprint": "a5b631a72632b58ff55e73015a25fa7412bfb6b7ac290ef6dabe21540ec2d669",
      "component_digests": {
        "payment-svc": "8ef1e56a607e4d4a5c12bed4eb0a4e9b753afb38790a34e362cbc954379aa53c"
      }
    },
    "payment-behavior": {
      "description": "",
      "mode": "behavior",
      "components": [
        "payment-svc"
      ],
      "fingerprint": "4ce3b0adc392eeb5e8cee87c3826d156365baca56dd37fdd67c3b63efa3aca7b",
      "component_digests": {
        "payment-svc": "5a0bfbf69284280a6d8963fe05ff89f36c7dde7a99e5e70d4f833a3bb5ee086b"
      }
    }
  }
}
