{
  "$schema": "https://raw.githubusercontent.com/yzm1/boundver/v0.16.0/spec/boundary.lock.schema.json",
  "schema": "boundary-lock/v4",
  "config_contract": "boundver-semantic-config/v3",
  "config_digest": "b469056e605fcf2b213c64fb5af99f539c8dcef79ad779a6429a5038dda66498",
  "project": "example-openapi",
  "components": {
    "svc": {
      "version": "1.2.3",
      "path": "examples/openapi/service",
      "boundary_provider": "openapi",
      "boundary_provider_version": "3",
      "boundary_status": "ok",
      "consumers": [],
      "external_consumers": [],
      "fingerprints": {
        "exact": "e9f574ffef564baf4a09780ee08492d0b8aae8a4ed13951c49e4f27312dfb4da",
        "behavior": null,
        "boundary": "2c7f98b4dcf9374fb174e1c3b29f8a28378e3410bf711be6858268fff650de75",
        "compat": "2b76e797e89bf0561229aa6249cdc899acef599712c928f7824203cbc93d644d"
      },
      "semver": {
        "compat_family": "1",
        "api_surface": "1.2",
        "exact_version": "1.2.3"
      }
    }
  },
  "slices": {
    "svc-boundary": {
      "description": "",
      "mode": "boundary",
      "components": [
        "svc"
      ],
      "fingerprint": "01e2467cbe08b090c24ac6f96889f1b2220264aecf6ac4a8058af646a6cfb336",
      "component_digests": {
        "svc": "2c7f98b4dcf9374fb174e1c3b29f8a28378e3410bf711be6858268fff650de75"
      }
    }
  }
}
