{
  "$schema": "https://raw.githubusercontent.com/yzm1/boundver/v0.16.0/spec/boundary.lock.schema.json",
  "schema": "boundary-lock/v4",
  "config_contract": "boundver-semantic-config/v3",
  "config_digest": "4f0fc150c8ec12de0a884814d72ea9d8b8cc6f18989f418c8d07eb84fd24b012",
  "project": "example-implicit-leaf",
  "components": {
    "worker": {
      "version": null,
      "path": "examples/implicit-and-leaf/worker",
      "boundary_provider": "implicit",
      "boundary_provider_version": "3",
      "boundary_status": "partial",
      "consumers": [],
      "external_consumers": [],
      "fingerprints": {
        "exact": "377dabb4cc7452a95e8d5b38e308fd72b8f31277daa335291fc08fb4c6219913",
        "behavior": null,
        "boundary": null,
        "compat": null
      },
      "semver": {
        "compat_family": null,
        "api_surface": null,
        "exact_version": null
      },
      "boundary_errors": [
        "No boundary paths declared for implicit boundary"
      ]
    },
    "leafsvc": {
      "version": null,
      "path": "examples/implicit-and-leaf/leafsvc",
      "boundary_provider": "leaf",
      "boundary_provider_version": "1",
      "boundary_status": "ok",
      "consumers": [],
      "external_consumers": [],
      "fingerprints": {
        "exact": "6094a54eed83a72aef6063908801de802094cfadf17a32fe9f22c78c5a408d7c",
        "behavior": null,
        "boundary": null,
        "compat": null
      },
      "semver": {
        "compat_family": null,
        "api_surface": null,
        "exact_version": null
      }
    }
  },
  "slices": {
    "worker-exact": {
      "description": "",
      "mode": "exact",
      "components": [
        "worker"
      ],
      "fingerprint": "35f4ea2be6dc4c05756d45c9d6d10813d61dfafc615ee5e4ccae1378caacafcd",
      "component_digests": {
        "worker": "377dabb4cc7452a95e8d5b38e308fd72b8f31277daa335291fc08fb4c6219913"
      }
    },
    "leaf-exact": {
      "description": "",
      "mode": "exact",
      "components": [
        "leafsvc"
      ],
      "fingerprint": "8c9e0540ce685774f4108cc15c2e55441c7e565f1bfccd2c45df66808316ed8e",
      "component_digests": {
        "leafsvc": "6094a54eed83a72aef6063908801de802094cfadf17a32fe9f22c78c5a408d7c"
      }
    }
  }
}
