{
  "$schema": "https://raw.githubusercontent.com/yzm1/boundver/v0.16.0/spec/boundary.lock.schema.json",
  "schema": "boundary-lock/v4",
  "config_contract": "boundver-semantic-config/v3",
  "config_digest": "dfe94c21f936963dbed300c667477346924c4cb6a2cba67c01e9af1d946f86e9",
  "project": "example-json-file",
  "components": {
    "svc": {
      "version": null,
      "path": "examples/json-file/service",
      "boundary_provider": "json-file",
      "boundary_provider_version": "3",
      "boundary_status": "ok",
      "consumers": [],
      "external_consumers": [],
      "fingerprints": {
        "exact": "a12f842442607bec1a5451bd12b9491d2bfcaa4073d30b808485a36227e83ab9",
        "behavior": null,
        "boundary": "778eff7ea2fdcf3e595c2df766de940a720d7f5a655cb7436e6cb221a72bf656",
        "compat": null
      },
      "semver": {
        "compat_family": null,
        "api_surface": null,
        "exact_version": null
      }
    }
  },
  "slices": {
    "svc-boundary": {
      "description": "",
      "mode": "boundary",
      "components": [
        "svc"
      ],
      "fingerprint": "aafe989dd647e156180249e242d5ba21ef1dbf689e607bbe3259b055f7cc0d1a",
      "component_digests": {
        "svc": "778eff7ea2fdcf3e595c2df766de940a720d7f5a655cb7436e6cb221a72bf656"
      }
    }
  }
}
