{
  "$schema": "https://raw.githubusercontent.com/yzm1/boundver/v0.16.0/spec/boundary.lock.schema.json",
  "schema": "boundary-lock/v4",
  "config_contract": "boundver-semantic-config/v3",
  "config_digest": "bf67b611ba2ea5963b57875dc692d9b1fdf88f3167baa5adac1777ad47749daf",
  "project": "boundver",
  "components": {
    "boundver": {
      "version": null,
      "path": "src/boundver",
      "boundary_provider": "python-exports",
      "boundary_provider_version": "3",
      "boundary_status": "ok",
      "consumers": [],
      "external_consumers": [],
      "fingerprints": {
        "exact": "d3d7c8a36873834227c67153fb966410740e2b2b5dc904d7241aa6760d086f34",
        "behavior": null,
        "boundary": "c67b37ef2743be3dfbf886522fc8fde03ef712a3eecf37fa5dd81fa69a777aa9",
        "compat": null
      },
      "semver": {
        "compat_family": null,
        "api_surface": null,
        "exact_version": null
      }
    },
    "spec": {
      "version": null,
      "path": "spec",
      "boundary_provider": "json-file",
      "boundary_provider_version": "3",
      "boundary_status": "ok",
      "consumers": [
        "boundver"
      ],
      "external_consumers": [],
      "fingerprints": {
        "exact": "c06f408a7c23a6b1d3b004aa179269a0021199934b6a81a8a798375a0e33806a",
        "behavior": null,
        "boundary": "2a8965d48f7efee5785e8bde0dd45ce137a3323e739ec2bc34b6532cb7cadeed",
        "compat": null
      },
      "semver": {
        "compat_family": null,
        "api_surface": null,
        "exact_version": null
      }
    }
  },
  "slices": {
    "cli-api": {
      "description": "CLI interface and public API surface",
      "mode": "boundary",
      "components": [
        "boundver"
      ],
      "fingerprint": "c636f797c9fec380007159b28abe986a2678e651d858045749b8b7677f3e725a",
      "component_digests": {
        "boundver": "c67b37ef2743be3dfbf886522fc8fde03ef712a3eecf37fa5dd81fa69a777aa9"
      }
    },
    "spec": {
      "description": "Spec documents and schemas",
      "mode": "exact",
      "components": [
        "spec"
      ],
      "fingerprint": "20b143f11f59da4d507f65e708ad8bfbc164018565f536adccf6fde8ac7724d5",
      "component_digests": {
        "spec": "c06f408a7c23a6b1d3b004aa179269a0021199934b6a81a8a798375a0e33806a"
      }
    },
    "all": {
      "description": "Full implementation fingerprint",
      "mode": "exact",
      "components": [
        "boundver",
        "spec"
      ],
      "fingerprint": "8cba4fa5ce26b0bf78ed3688ddb920259bca999bd4d24bf727936d43d5f1f722",
      "component_digests": {
        "boundver": "d3d7c8a36873834227c67153fb966410740e2b2b5dc904d7241aa6760d086f34",
        "spec": "c06f408a7c23a6b1d3b004aa179269a0021199934b6a81a8a798375a0e33806a"
      }
    }
  }
}
