{
  "$schema": "https://raw.githubusercontent.com/yzm1/boundver/v0.16.0/spec/boundary.lock.schema.json",
  "schema": "boundary-lock/v4",
  "config_contract": "boundver-semantic-config/v3",
  "config_digest": "959cbdda1546c7b05dc40b38b483f128c701cad51a2b55fe633e4aa1771a386e",
  "project": "example-python-package",
  "components": {
    "pkg": {
      "version": "1.4.0",
      "path": "examples/python-package/pkg",
      "boundary_provider": "python-exports",
      "boundary_provider_version": "3",
      "boundary_status": "ok",
      "consumers": [],
      "external_consumers": [],
      "fingerprints": {
        "exact": "d48b3630cefdaf226f77864eb92ee160db6b64b90d15c2418cc205b007b024df",
        "behavior": null,
        "boundary": "be36e61efb98760cf0eabe4072219a9e44eb65f29630a73cd6c4e674eda4b849",
        "compat": "25a26a7d0679ba49343fd94ad6d43f57fb09ca144c2c5bf614185e2e4a10ebe9"
      },
      "semver": {
        "compat_family": "1",
        "api_surface": "1.4",
        "exact_version": "1.4.0"
      }
    }
  },
  "slices": {
    "pkg-boundary": {
      "description": "",
      "mode": "boundary",
      "components": [
        "pkg"
      ],
      "fingerprint": "847647ee93145b4e4afb671cd042d79af3f6869353a753651c2b5a8e3a717bf9",
      "component_digests": {
        "pkg": "be36e61efb98760cf0eabe4072219a9e44eb65f29630a73cd6c4e674eda4b849"
      }
    }
  }
}
